{
  "execution_id": "first-eligible-quote-v1",
  "measurement_id": "post-publication-quote-jpy-v1",
  "evidence_kind": "fixture",
  "broker": null,
  "account": null,
  "product_specification": null,
  "instruments": [
    {
      "model_pair": "JPY/USD",
      "base": "USD",
      "quote": "JPY",
      "lot_size": 1.0,
      "minimum_trade": 1.0,
      "margin_rate": 0.02
    },
    {
      "model_pair": "JPY/EUR",
      "base": "EUR",
      "quote": "JPY",
      "lot_size": 1.0,
      "minimum_trade": 1.0,
      "margin_rate": 0.02
    },
    {
      "model_pair": "JPY/GBP",
      "base": "GBP",
      "quote": "JPY",
      "lot_size": 1.0,
      "minimum_trade": 1.0,
      "margin_rate": 0.02
    },
    {
      "model_pair": "JPY/AUD",
      "base": "AUD",
      "quote": "JPY",
      "lot_size": 1.0,
      "minimum_trade": 1.0,
      "margin_rate": 0.02
    },
    {
      "model_pair": "JPY/CHF",
      "base": "CHF",
      "quote": "JPY",
      "lot_size": 1.0,
      "minimum_trade": 1.0,
      "margin_rate": 0.02
    },
    {
      "model_pair": "JPY/CAD",
      "base": "CAD",
      "quote": "JPY",
      "lot_size": 1.0,
      "minimum_trade": 1.0,
      "margin_rate": 0.02
    },
    {
      "model_pair": "JPY/NZD",
      "base": "NZD",
      "quote": "JPY",
      "lot_size": 1.0,
      "minimum_trade": 1.0,
      "margin_rate": 0.02
    },
    {
      "model_pair": "JPY/NOK",
      "base": "NOK",
      "quote": "JPY",
      "lot_size": 1.0,
      "minimum_trade": 1.0,
      "margin_rate": 0.02
    },
    {
      "model_pair": "JPY/SEK",
      "base": "SEK",
      "quote": "JPY",
      "lot_size": 1.0,
      "minimum_trade": 1.0,
      "margin_rate": 0.02
    }
  ],
  "calendar": {
    "timezone": "America/New_York",
    "holidays": [
      "2024-03-09",
      "2024-03-10"
    ],
    "sessions": [
      {
        "open": "2024-03-08T00:00:00Z",
        "close": "2024-03-08T23:00:00Z"
      },
      {
        "open": "2024-03-11T00:00:00Z",
        "close": "2024-03-11T23:00:00Z"
      },
      {
        "open": "2024-03-12T00:00:00Z",
        "close": "2024-03-12T23:00:00Z"
      }
    ],
    "source": "synthetic-calendar"
  },
  "costs": {
    "fixed_spread_debit": 0.0,
    "commission_rate": 0.0,
    "markup_per_base_day": [0.0, 0.0, 0.0, 0.0, 0.0, 0.0, 0.0, 0.0, 0.0],
    "swap_includes_markup": false,
    "source": "explicit synthetic zero fees; bid/ask charged"
  },
  "funding": [
    {
      "start": "2024-03-08T00:00:00Z",
      "end": "2024-03-13T00:00:00Z",
      "long_jpy_per_base_day": [0.0, 0.0, 0.0, 0.0, 0.0, 0.0, 0.0, 0.0, 0.0],
      "short_jpy_per_base_day": [0.0, 0.0, 0.0, 0.0, 0.0, 0.0, 0.0, 0.0, 0.0],
      "source": "deterministic-fixture",
      "quality": "synthetic",
      "available_at": "2024-03-07T00:00:00Z",
      "retrieved_at": "2024-03-07T00:00:00Z"
    }
  ],
  "initial_mark": {
    "timestamp": "2024-03-08T21:59:58Z",
    "mid": [100.0, 100.0, 100.0, 100.0, 100.0, 100.0, 100.0, 100.0, 100.0],
    "source": "deterministic-fixture",
    "quality": "synthetic",
    "available_at": "2024-03-08T21:59:58Z",
    "retrieved_at": "2024-03-08T21:59:58Z"
  },
  "steps": [
    {
      "bar_label": "2024-03-08",
      "session_close": "2024-03-08T21:59:58Z",
      "inputs": [
        {
          "name": "market_and_carry_window",
          "payload_sha256": "c770901567561c0e4e29e915afc6756d2fcbfa1d13907723d31806874f787a79",
          "source": "deterministic-fixture",
          "quality": "synthetic",
          "available_at": "2024-03-08T21:59:58Z",
          "retrieved_at": "2024-03-08T21:59:58Z"
        }
      ],
      "window": [
        [
          [0.0, 0.01, 1.0, -0.04, 0.0, 0.0, 0.0, 0.0],
          [0.0, 0.01, 1.0, -0.04, 0.0, 0.0, 0.0, 0.0],
          [0.0, 0.01, 1.0, -0.04, 0.0, 0.0, 0.0, 0.0],
          [0.0, 0.01, 1.0, -0.04, 0.0, 0.0, 0.0, 0.0],
          [0.0, 0.01, 1.0, -0.04, 0.0, 0.0, 0.0, 0.0],
          [0.0, 0.01, 1.0, -0.04, 0.0, 0.0, 0.0, 0.0],
          [0.0, 0.01, 1.0, -0.04, 0.0, 0.0, 0.0, 0.0],
          [0.0, 0.01, 1.0, -0.04, 0.0, 0.0, 0.0, 0.0],
          [0.0, 0.01, 1.0, -0.04, 0.0, 0.0, 0.0, 0.0],
          [0.0, 0.01, 1.0, -0.04, 0.0, 0.0, 0.0, 0.0],
          [0.0, 0.01, 1.0, -0.04, 0.0, 0.0, 0.0, 0.0],
          [0.0, 0.01, 1.0, -0.04, 0.0, 0.0, 0.0, 0.0],
          [0.0, 0.01, 1.0, -0.04, 0.0, 0.0, 0.0, 0.0],
          [0.0, 0.01, 1.0, -0.04, 0.0, 0.0, 0.0, 0.0],
          [0.0, 0.01, 1.0, -0.04, 0.0, 0.0, 0.0, 0.0],
          [0.0, 0.01, 1.0, -0.04, 0.0, 0.0, 0.0, 0.0],
          [0.0, 0.01, 1.0, -0.04, 0.0, 0.0, 0.0, 0.0],
          [0.0, 0.01, 1.0, -0.04, 0.0, 0.0, 0.0, 0.0],
          [0.0, 0.01, 1.0, -0.04, 0.0, 0.0, 0.0, 0.0],
          [0.0, 0.01, 1.0, -0.04, 0.0, 0.0, 0.0, 0.0],
          [0.0, 0.01, 1.0, -0.04, 0.0, 0.0, 0.0, 0.0],
          [0.0, 0.01, 1.0, -0.04, 0.0, 0.0, 0.0, 0.0],
          [0.0, 0.01, 1.0, -0.04, 0.0, 0.0, 0.0, 0.0],
          [0.0, 0.01, 1.0, -0.04, 0.0, 0.0, 0.0, 0.0],
          [0.0, 0.01, 1.0, -0.04, 0.0, 0.0, 0.0, 0.0],
          [0.0, 0.01, 1.0, -0.04, 0.0, 0.0, 0.0, 0.0],
          [0.0, 0.01, 1.0, -0.04, 0.0, 0.0, 0.0, 0.0],
          [0.0, 0.01, 1.0, -0.04, 0.0, 0.0, 0.0, 0.0],
          [0.0, 0.01, 1.0, -0.04, 0.0, 0.0, 0.0, 0.0],
          [0.0, 0.01, 1.0, -0.04, 0.0, 0.0, 0.0, 0.0],
          [0.0, 0.01, 1.0, -0.04, 0.0, 0.0, 0.0, 0.0],
          [0.0, 0.01, 1.0, -0.04, 0.0, 0.0, 0.0, 0.0]
        ],
        [
          [0.0, 0.01, 1.0, -0.03, 0.0, 0.0, 0.0, 0.0],
          [0.0, 0.01, 1.0, -0.03, 0.0, 0.0, 0.0, 0.0],
          [0.0, 0.01, 1.0, -0.03, 0.0, 0.0, 0.0, 0.0],
          [0.0, 0.01, 1.0, -0.03, 0.0, 0.0, 0.0, 0.0],
          [0.0, 0.01, 1.0, -0.03, 0.0, 0.0, 0.0, 0.0],
          [0.0, 0.01, 1.0, -0.03, 0.0, 0.0, 0.0, 0.0],
          [0.0, 0.01, 1.0, -0.03, 0.0, 0.0, 0.0, 0.0],
          [0.0, 0.01, 1.0, -0.03, 0.0, 0.0, 0.0, 0.0],
          [0.0, 0.01, 1.0, -0.03, 0.0, 0.0, 0.0, 0.0],
          [0.0, 0.01, 1.0, -0.03, 0.0, 0.0, 0.0, 0.0],
          [0.0, 0.01, 1.0, -0.03, 0.0, 0.0, 0.0, 0.0],
          [0.0, 0.01, 1.0, -0.03, 0.0, 0.0, 0.0, 0.0],
          [0.0, 0.01, 1.0, -0.03, 0.0, 0.0, 0.0, 0.0],
          [0.0, 0.01, 1.0, -0.03, 0.0, 0.0, 0.0, 0.0],
          [0.0, 0.01, 1.0, -0.03, 0.0, 0.0, 0.0, 0.0],
          [0.0, 0.01, 1.0, -0.03, 0.0, 0.0, 0.0, 0.0],
          [0.0, 0.01, 1.0, -0.03, 0.0, 0.0, 0.0, 0.0],
          [0.0, 0.01, 1.0, -0.03, 0.0, 0.0, 0.0, 0.0],
          [0.0, 0.01, 1.0, -0.03, 0.0, 0.0, 0.0, 0.0],
          [0.0, 0.01, 1.0, -0.03, 0.0, 0.0, 0.0, 0.0],
          [0.0, 0.01, 1.0, -0.03, 0.0, 0.0, 0.0, 0.0],
          [0.0, 0.01, 1.0, -0.03, 0.0, 0.0, 0.0, 0.0],
          [0.0, 0.01, 1.0, -0.03, 0.0, 0.0, 0.0, 0.0],
          [0.0, 0.01, 1.0, -0.03, 0.0, 0.0, 0.0, 0.0],
          [0.0, 0.01, 1.0, -0.03, 0.0, 0.0, 0.0, 0.0],
          [0.0, 0.01, 1.0, -0.03, 0.0, 0.0, 0.0, 0.0],
          [0.0, 0.01, 1.0, -0.03, 0.0, 0.0, 0.0, 0.0],
          [0.0, 0.01, 1.0, -0.03, 0.0, 0.0, 0.0, 0.0],
          [0.0, 0.01, 1.0, -0.03, 0.0, 0.0, 0.0, 0.0],
          [0.0, 0.01, 1.0, -0.03, 0.0, 0.0, 0.0, 0.0],
          [0.0, 0.01, 1.0, -0.03, 0.0, 0.0, 0.0, 0.0],
          [0.0, 0.01, 1.0, -0.03, 0.0, 0.0, 0.0, 0.0]
        ],
        [
          [0.0, 0.01, 1.0, -0.02, 0.0, 0.0, 0.0, 0.0],
          [0.0, 0.01, 1.0, -0.02, 0.0, 0.0, 0.0, 0.0],
          [0.0, 0.01, 1.0, -0.02, 0.0, 0.0, 0.0, 0.0],
          [0.0, 0.01, 1.0, -0.02, 0.0, 0.0, 0.0, 0.0],
          [0.0, 0.01, 1.0, -0.02, 0.0, 0.0, 0.0, 0.0],
          [0.0, 0.01, 1.0, -0.02, 0.0, 0.0, 0.0, 0.0],
          [0.0, 0.01, 1.0, -0.02, 0.0, 0.0, 0.0, 0.0],
          [0.0, 0.01, 1.0, -0.02, 0.0, 0.0, 0.0, 0.0],
          [0.0, 0.01, 1.0, -0.02, 0.0, 0.0, 0.0, 0.0],
          [0.0, 0.01, 1.0, -0.02, 0.0, 0.0, 0.0, 0.0],
          [0.0, 0.01, 1.0, -0.02, 0.0, 0.0, 0.0, 0.0],
          [0.0, 0.01, 1.0, -0.02, 0.0, 0.0, 0.0, 0.0],
          [0.0, 0.01, 1.0, -0.02, 0.0, 0.0, 0.0, 0.0],
          [0.0, 0.01, 1.0, -0.02, 0.0, 0.0, 0.0, 0.0],
          [0.0, 0.01, 1.0, -0.02, 0.0, 0.0, 0.0, 0.0],
          [0.0, 0.01, 1.0, -0.02, 0.0, 0.0, 0.0, 0.0],
          [0.0, 0.01, 1.0, -0.02, 0.0, 0.0, 0.0, 0.0],
          [0.0, 0.01, 1.0, -0.02, 0.0, 0.0, 0.0, 0.0],
          [0.0, 0.01, 1.0, -0.02, 0.0, 0.0, 0.0, 0.0],
          [0.0, 0.01, 1.0, -0.02, 0.0, 0.0, 0.0, 0.0],
          [0.0, 0.01, 1.0, -0.02, 0.0, 0.0, 0.0, 0.0],
          [0.0, 0.01, 1.0, -0.02, 0.0, 0.0, 0.0, 0.0],
          [0.0, 0.01, 1.0, -0.02, 0.0, 0.0, 0.0, 0.0],
          [0.0, 0.01, 1.0, -0.02, 0.0, 0.0, 0.0, 0.0],
          [0.0, 0.01, 1.0, -0.02, 0.0, 0.0, 0.0, 0.0],
          [0.0, 0.01, 1.0, -0.02, 0.0, 0.0, 0.0, 0.0],
          [0.0, 0.01, 1.0, -0.02, 0.0, 0.0, 0.0, 0.0],
          [0.0, 0.01, 1.0, -0.02, 0.0, 0.0, 0.0, 0.0],
          [0.0, 0.01, 1.0, -0.02, 0.0, 0.0, 0.0, 0.0],
          [0.0, 0.01, 1.0, -0.02, 0.0, 0.0, 0.0, 0.0],
          [0.0, 0.01, 1.0, -0.02, 0.0, 0.0, 0.0, 0.0],
          [0.0, 0.01, 1.0, -0.02, 0.0, 0.0, 0.0, 0.0]
        ],
        [
          [0.0, 0.01, 1.0, -0.01, 0.0, 0.0, 0.0, 0.0],
          [0.0, 0.01, 1.0, -0.01, 0.0, 0.0, 0.0, 0.0],
          [0.0, 0.01, 1.0, -0.01, 0.0, 0.0, 0.0, 0.0],
          [0.0, 0.01, 1.0, -0.01, 0.0, 0.0, 0.0, 0.0],
          [0.0, 0.01, 1.0, -0.01, 0.0, 0.0, 0.0, 0.0],
          [0.0, 0.01, 1.0, -0.01, 0.0, 0.0, 0.0, 0.0],
          [0.0, 0.01, 1.0, -0.01, 0.0, 0.0, 0.0, 0.0],
          [0.0, 0.01, 1.0, -0.01, 0.0, 0.0, 0.0, 0.0],
          [0.0, 0.01, 1.0, -0.01, 0.0, 0.0, 0.0, 0.0],
          [0.0, 0.01, 1.0, -0.01, 0.0, 0.0, 0.0, 0.0],
          [0.0, 0.01, 1.0, -0.01, 0.0, 0.0, 0.0, 0.0],
          [0.0, 0.01, 1.0, -0.01, 0.0, 0.0, 0.0, 0.0],
          [0.0, 0.01, 1.0, -0.01, 0.0, 0.0, 0.0, 0.0],
          [0.0, 0.01, 1.0, -0.01, 0.0, 0.0, 0.0, 0.0],
          [0.0, 0.01, 1.0, -0.01, 0.0, 0.0, 0.0, 0.0],
          [0.0, 0.01, 1.0, -0.01, 0.0, 0.0, 0.0, 0.0],
          [0.0, 0.01, 1.0, -0.01, 0.0, 0.0, 0.0, 0.0],
          [0.0, 0.01, 1.0, -0.01, 0.0, 0.0, 0.0, 0.0],